{
  "protocol_version": "codeattest.v0",
  "key_id": "codeattest-demo-signing-key",
  "key_version": "v0",
  "algorithm_profile": "ml_dsa_65",
  "public_key": "9UCDN9D-5lwohRImpfqBtYRkYyx44qm-9w0zDy46X3TZz2dq7dEGfJGl3V1O3Eb4aKk__sn0TiVORPaCoVOurfIo6Nt8X8_tMMw0COJhq4lodr7lZmDSp8HX6sIMV1QlUgahePcVYpUGXOeHb5DEj0S8N_OgDjLu_TpLseKY_ig9EG6u-SozpZQlOioHkJdqHQRjb4Zy0owGyFLqi7Q7hL_1EpludhaWPVuaKQZGahUsfqm-F4vjVAVoO0Q2evhdLarYdjDB4hulSQFU8BQXgPXtBAfLC5dd1W1ZMPmyZBO4Q7g_NpMwSwA4vT5Ls5iGgGDqGMnGcJk3ZHClDesFLkBWdD-83wNBsZJmO9HCG6Oz1WZuDQ4pxOHtB1mrC9nR01UBG5Tg_wwEmwPdtxOGQGZxRPys1yZfVaB-U4fxq9MMA3zxTUNqqFX4JwSSFUQNgAf2FGBQDZQ_V_-2v-5v7dL87FKILX2Noaqynoksi-rD3zI0tKfS7KOkXGYjxSu90HwclDFLcGmIpSAp-PiwbodLdB1ykmZSx4xqziz9iGTq2y5LOcr-bgPk7br6J0fbm8Qvkq-LAx4-OAhGsb_RWt6IwoXWpv_-ker8ixfebLxoV18yPMCfwg5J6O_Xb5VovsSGt430JFQo2NDV9Thz4R3mX9pMdwtSGoxn9cUdSMwmNYlUUURHiB_ZpC5YkdrH4dtSSdeGGzIhEeX7kpvun_Xp1aJme6k-Y_wDBA0ugmSPieid7B0dLfue_s63lA99y-vrWiOcwcVNj31Sy6Ig0GNOFd9GpYKAvFpIhAvTknTP3hUPmtmkD2OY1xU1CSXw4FAZRECfMjMaNivaqvs9jOcclkMy1q-35oT5mVEkbYgIHIZ0SuaBM_IsU6S1riWPIwqYSR0tQ6eabQ9NVKO2IBOWWsfILQUHElo4oCd_gcvB1GzvKhMcb1G4jsC6rgyCpqDnKDHLBvkRbP9REdWX4BBX0ygFoAj1LJrsMxETm_s1mCeJ_4O90MMenxCA6O2OuZ_eZrr7KeM1c4n-N4W2DHjiKe8HPhtl402Ei9TYpPJRVR4tONJUavvCBdPG2rNNK5YrGvtE8dIvwQxnRPzWtjav08tBSxbC4NcI_p9R_xkSC95pOwKLbR5tvje0uLO8fG96hCcBYDhp097VclAPCFUC78jTzGKzDlzby16G2cDUKXO_dV31OcwK6lj5FIOG22e9K_cM0SzNltXGb7JxQWt3JGUijcRLB5F4-bdmNwtmp5uHH6yiRspvj2O-nwZoKXrERsrVz0qDMYsbAOy9KD8O7O5gqaN6J6vb2-OC4weXAAKDffwL05NOvQCJGP1L04PALJ039pSZbpiaSQdXZ-vEopge9SdUVeAmywvXCUbN0fra8lE4HTJPnvu4YNGygMKWhbq5fQEGdic7RcyhKsOWaq40LITiNX7M8lJXd0O4eHlntAsH7y09nmwaO8sFnLoP238NT4FcJCuOFKzTN15gjpIwujz4cY9DiCo-HmYaK76Bgw00dB8zRz4mOzeQq-Z6zyn130SGWy_7yWl1_WJzimQRLe2lolNPsKI7OzAk35hjkbrfkEHFk8MTp8oeH8_8tlsHuamTN7SkrPYWy-FVPrlUHziqYkc0KQWZUjOigXLKEzlrKpZilwEg-CuSohP0PeeiMszKMmgmXJzgQtUJFUMKbEVfMid9pC-ZYvuRY7YjIx68CA-nuOn5Ah_PhbmPnEg-TSImuTJqW8sudEnvAprhQtOg8MKL1PfpxRoS4TNvJN-svD-Aio991oMCe8lIdjuAj7ADc5S4tBvJsux4h-Z1hOA9EbFcogOyvLQ_iIFjjE5O7n-EbQnH-Jt3Od8issOswjUDK6j3rie1udJXMxQ-gKTN3mdwcZweZuws5oNhIjPoj6__hMB0WpiqElTIIZxsVWNIwrXRvuthUy1r973hUycdxkdGC-tl_gBVsz_WSA3LudfUcZUs-lviYMOXIajFyJuelmri3JA2RR7J8sSUM7IiXhPyPiDCv7qBp7OlVYg0SSOPfUghPp8Qzhnnbxvc_HPuVSS9fYvgpLRnhOI4IzwE-5k4Psdyb5cX4Red0U-6mtbC69Fpnwqw5X5srSOHWwKeic_aBvUSZuzS7tTtr7UegvKlBtV7p02mEXdMpfov_0qXZRneQliF59CSGc-BWxdn1PxacsGJGJkaKFCGpqdmYUpNJFOH2lDyjdd4-zOriMCRj-ujdoxVux8HrsM8_u0z1vqk00_XIns2VTPB5n28ifCyAZXPHL1IDTM63hybsoMICFtyztQwJowUkqJwUMQ2aK3Jz4uFCUR8_NPI-NjrVU9wQQF4aqnryoaZHSUHdqN6H1b799COWR-XjaScOHBiWHn3DiQYrsXLoy-ow0b6kDi668Na0AaKTQNTeu4UwucVcKh0kDd_qN1m-ZWqBEpSLwxwJaerLdWtMKZCaNwRK3-foVbfZNYx9V8dbtxVzsVwqcc3LingLI1IZ7riSUMdz27SeUoBg_D3UBIB_spKgdM0xkL8jTjpqQ-ndClmXgniFHl9-kVf9HxPIZ06LLAXa8IjZFUSPBxdpxStKdWA-xlPhxc6GNw",
  "custody_mode": "self_hosted_software",
  "valid_from": "2025-08-16T00:00:00Z",
  "valid_until": "2026-08-16T00:00:00Z",
  "status": "retired",
  "limitations": [
    "SYNTHETIC_DEMO_DATA This key is a published test vector and must never be trusted by a deployment. NOT_CUSTOMER_SOURCE.",
    "Key custody is self-hosted software custody in a non-validated module, not a hardware security module."
  ]
}
